{"$schema":"https://json-schema.org/draft/2020-12/schema","title":"Corpus snapshot v5","type":"object","required":["snapshot_id","corpus_version","inputs","counts","research_eligibility"],"properties":{"snapshot_id":{"type":"string"},"corpus_version":{"type":"string"},"inputs":{"type":"array","items":{"type":"string"}},"counts":{"type":"object"},"research_eligibility":{"type":"object"},"notes":{"type":["string","null"]}},"additionalProperties":false}