{"snapshot_id":"CH-5.0.0","corpus_version":"5.0.0","inputs":["corpus/chic-catalogue-spine.json","signs/chic-core-sign-registry.json","corpus/critical-readings.json","corpus/evidence-packets.json","corpus/verification-events.json","corpus/graph-observations.json","corpus/extensions.json","bibliography/sources.json","bibliography/source-access.json"],"counts":{"catalogue_objects":331,"core_numbered_signs":96,"critical_readings":0,"source_checked_occurrence_objects":0,"independently_reviewed_objects":0,"post_chic_extensions":0},"research_eligibility":{"internal_structural_analysis":"BLOCKED","ch_linear_a_comparison":"BLOCKED","fine_matched_degradation":"BLOCKED"},"notes":"5.0 is the stable production contract for critical-corpus enrichment; it does not fabricate unavailable evidence."}